{
  "schema_version": "1.1.0",
  "generator": {
    "name": "cmz-generator-platform",
    "version": "1.2.0"
  },
  "input": {
    "model_id": "newsletter-action-request-semantic",
    "sha256": "71bbd5357296080460f40ea38306651a5fc1b72917ada265e1e433762223cb58"
  },
  "plan": {
    "plan_id": "newsletter-action-request-semantic:artifacts",
    "sha256": "b2a7bf0b1c1ef541c3975e89fc6eec99521e77de6b10302214e54be901fa0f67"
  },
  "target": {
    "profile_id": "angular-nx",
    "profile_version": "1.0.0",
    "profile_sha256": "59c4a50ab91ac1eaee73c11833dfb1a0eba11082542e5b1ef7371cdb17d3c2e6"
  },
  "files": [
    {
      "path": "project.json",
      "artifact_id": "package-descriptor",
      "owner": "generator-owned",
      "write_policy": "replace",
      "bytes": 226,
      "sha256": "8269b1c0b4c8fd410e16ab11753c2e1d068dff7c45f1b15f8c80d98ea076ca8a"
    },
    {
      "path": "src/action-request-client.ts",
      "artifact_id": "integration-client",
      "owner": "generator-owned",
      "write_policy": "replace",
      "bytes": 1458,
      "sha256": "ef5aa2524e38f6c13e526a045c2d600d807f97b3387197a188605f264d6bde28"
    },
    {
      "path": "src/action-request-commands.ts",
      "artifact_id": "runtime-binding",
      "owner": "generator-owned",
      "write_policy": "replace",
      "bytes": 1078,
      "sha256": "51d13213c0476e91169de66e9920aae484c059a2fa72c9ab86f4abc757aff8a7"
    },
    {
      "path": "src/after-success.extension.ts",
      "artifact_id": "after-success-extension",
      "owner": "human-owned",
      "write_policy": "preserve",
      "bytes": 224,
      "sha256": "aa69da7f7a1e6c507d6710e5cf050faab530101d568011b2c0e04f6c538db3fe"
    },
    {
      "path": "src/extension-contract.ts",
      "artifact_id": "extension-contract",
      "owner": "generator-owned",
      "write_policy": "replace",
      "bytes": 292,
      "sha256": "5ee0f055e926ae3c453661e062c4db95e2137c2179e4fc277c56a163f6200c05"
    },
    {
      "path": "src/index.ts",
      "artifact_id": "public-api",
      "owner": "generator-owned",
      "write_policy": "replace",
      "bytes": 221,
      "sha256": "5148a8e62284c9b05c6c5b9decbb3ec7393caff5934882e6243e78a7117e6e32"
    },
    {
      "path": "src/models.ts",
      "artifact_id": "domain-model",
      "owner": "generator-owned",
      "write_policy": "replace",
      "bytes": 193,
      "sha256": "c04f3a7e232fab6400a2a4ca02cbd6f523bba5704d317e8c0391bb73a3ed8db4"
    },
    {
      "path": "src/validation.ts",
      "artifact_id": "input-validator",
      "owner": "generator-owned",
      "write_policy": "replace",
      "bytes": 604,
      "sha256": "99f5590c2f6012629defaf5f0bed0a6549a43e25d443b7c4c91e6407dd3c91a7"
    },
    {
      "path": "tsconfig.json",
      "artifact_id": "compiler-configuration",
      "owner": "generator-owned",
      "write_policy": "replace",
      "bytes": 253,
      "sha256": "cadc5053a749d3ad79f4f773d1ecf1b5eeb8430b1373bd291f5b7bf307f8d659"
    }
  ],
  "tree_sha256": "53a467458f8e6dcc1b6f537e1c4c7dccc64eec4031550b2fb447e2f2ef6cfa85"
}
