{
  "schema_version": "1.1.0",
  "generator": { "name": "cmz-generator-platform", "version": "1.2.0" },
  "input": {
    "model_id": "authentication-action-request-semantic",
    "sha256": "6d0c4dc7f47621d449b8c8d94309f2b4dfd24785b1b7d402ade93d5c88b122c9"
  },
  "plan": {
    "plan_id": "authentication-action-request-semantic:artifacts",
    "sha256": "96a5c4a3f1c88327f43d8197fb29e767833d9b6ab722c57647a6e770af239240"
  },
  "target": {
    "profile_id": "react-typescript",
    "profile_version": "1.0.0",
    "profile_sha256": "91b15dc02bb36def8ba6ead2fca2b265465128a6b2bb3b0d41d45306029cd66f"
  },
  "files": [
    {
      "path": "package.json",
      "artifact_id": "package-descriptor",
      "owner": "generator-owned",
      "write_policy": "replace",
      "bytes": 135,
      "sha256": "cce8f5b86b0d4cc2d2a8e236e01db7f1b92291b0adb47ef81636b5f48ed9bb81"
    },
    {
      "path": "src/action-request-client.ts",
      "artifact_id": "integration-client",
      "owner": "generator-owned",
      "write_policy": "replace",
      "bytes": 3019,
      "sha256": "ed7817ffa93780a7b02950f2a513d768c7f91c18b641b02abfccc7d9b6dc597f"
    },
    {
      "path": "src/after-success.extension.ts",
      "artifact_id": "after-success-extension",
      "owner": "human-owned",
      "write_policy": "preserve",
      "bytes": 224,
      "sha256": "aa69da7f7a1e6c507d6710e5cf050faab530101d568011b2c0e04f6c538db3fe"
    },
    {
      "path": "src/extension-contract.ts",
      "artifact_id": "extension-contract",
      "owner": "generator-owned",
      "write_policy": "replace",
      "bytes": 421,
      "sha256": "aa7ff10a3f80f50eecfe9cf32fbc7e5d3365fd27744d490ada41682c0675ad78"
    },
    {
      "path": "src/index.ts",
      "artifact_id": "public-api",
      "owner": "generator-owned",
      "write_policy": "replace",
      "bytes": 225,
      "sha256": "ab32ae5c8f9eb174bfa2dadb6f17c37be06913aaec0a4a6e4eaf3e46aadaca0a"
    },
    {
      "path": "src/models.ts",
      "artifact_id": "domain-model",
      "owner": "generator-owned",
      "write_policy": "replace",
      "bytes": 664,
      "sha256": "99328eaf2cf988002f992e4b122db84e377f66e5e7972a8ed15c6d109057c25a"
    },
    {
      "path": "src/use-action-request-commands.ts",
      "artifact_id": "runtime-binding",
      "owner": "generator-owned",
      "write_policy": "replace",
      "bytes": 3665,
      "sha256": "cea9184fd8cbc673f1ba80ad1690b69ef8e960c0883e98e9a4be6cd43ad8df3f"
    },
    {
      "path": "src/validation.ts",
      "artifact_id": "input-validator",
      "owner": "generator-owned",
      "write_policy": "replace",
      "bytes": 2060,
      "sha256": "c8c2f4c54fcecd55ba10b56a15b831f27343169d93208ac2e860fdf65b4858aa"
    },
    {
      "path": "tsconfig.json",
      "artifact_id": "compiler-configuration",
      "owner": "generator-owned",
      "write_policy": "replace",
      "bytes": 217,
      "sha256": "f26760b71af6d3bfe07ca163a2357eeb24bd6155f614a82ea67fb7951482e300"
    }
  ],
  "tree_sha256": "0cbfaf6dc6f47e2c43f02ea3236e07abedb0f012896e9a58223d861732d179ce"
}
