{
  "schema_version": "1.1.0",
  "generator": {
    "name": "cmz-generator-platform",
    "version": "1.2.0"
  },
  "input": {
    "model_id": "newsletter-action-request-semantic",
    "sha256": "71bbd5357296080460f40ea38306651a5fc1b72917ada265e1e433762223cb58"
  },
  "plan": {
    "plan_id": "newsletter-action-request-semantic:artifacts",
    "sha256": "b2a7bf0b1c1ef541c3975e89fc6eec99521e77de6b10302214e54be901fa0f67"
  },
  "target": {
    "profile_id": "react-typescript",
    "profile_version": "1.0.0",
    "profile_sha256": "91b15dc02bb36def8ba6ead2fca2b265465128a6b2bb3b0d41d45306029cd66f"
  },
  "files": [
    {
      "path": "package.json",
      "artifact_id": "package-descriptor",
      "owner": "generator-owned",
      "write_policy": "replace",
      "bytes": 131,
      "sha256": "507583aaa57cda541684298af9c6fd349c2c8f9d30ffce39666099ef669582e0"
    },
    {
      "path": "src/action-request-client.ts",
      "artifact_id": "integration-client",
      "owner": "generator-owned",
      "write_policy": "replace",
      "bytes": 1523,
      "sha256": "3e7f3b4fad94e1dea05c9f879c085698d3da21e6a7ff5d28a2cb99b0577bb179"
    },
    {
      "path": "src/after-success.extension.ts",
      "artifact_id": "after-success-extension",
      "owner": "human-owned",
      "write_policy": "preserve",
      "bytes": 224,
      "sha256": "aa69da7f7a1e6c507d6710e5cf050faab530101d568011b2c0e04f6c538db3fe"
    },
    {
      "path": "src/extension-contract.ts",
      "artifact_id": "extension-contract",
      "owner": "generator-owned",
      "write_policy": "replace",
      "bytes": 292,
      "sha256": "5ee0f055e926ae3c453661e062c4db95e2137c2179e4fc277c56a163f6200c05"
    },
    {
      "path": "src/index.ts",
      "artifact_id": "public-api",
      "owner": "generator-owned",
      "write_policy": "replace",
      "bytes": 225,
      "sha256": "ab32ae5c8f9eb174bfa2dadb6f17c37be06913aaec0a4a6e4eaf3e46aadaca0a"
    },
    {
      "path": "src/models.ts",
      "artifact_id": "domain-model",
      "owner": "generator-owned",
      "write_policy": "replace",
      "bytes": 193,
      "sha256": "c04f3a7e232fab6400a2a4ca02cbd6f523bba5704d317e8c0391bb73a3ed8db4"
    },
    {
      "path": "src/use-action-request-commands.ts",
      "artifact_id": "runtime-binding",
      "owner": "generator-owned",
      "write_policy": "replace",
      "bytes": 1921,
      "sha256": "bbeec249219e1d5f37b103c949852ec99f08a4febe76a12f1d7ca94d5c95f927"
    },
    {
      "path": "src/validation.ts",
      "artifact_id": "input-validator",
      "owner": "generator-owned",
      "write_policy": "replace",
      "bytes": 604,
      "sha256": "99f5590c2f6012629defaf5f0bed0a6549a43e25d443b7c4c91e6407dd3c91a7"
    },
    {
      "path": "tsconfig.json",
      "artifact_id": "compiler-configuration",
      "owner": "generator-owned",
      "write_policy": "replace",
      "bytes": 217,
      "sha256": "f26760b71af6d3bfe07ca163a2357eeb24bd6155f614a82ea67fb7951482e300"
    }
  ],
  "tree_sha256": "91b81c5328b404cbd066562fdbc3be1112691543f02ed040051018c7f771f5a4"
}
